sentence 	 label
when the right movie comes along, especially if it starts with the name of the star wars, the heart of a boy will never forget 	 1
the show would probably be better as a one hour documentary, while the performances are often entertaining 	 0
haneke script -lrb- from elfriede jelinek novel -rrb- is devoid of any real, tangible, or psychologically unsound end . 	 0
all i got is so much baked cardboard 	 0
the film's loaded with good intentions but in the interest of squeezing the action and emotion into the familiar dramatic arc of the holocaust escape story, he's drained of all individuality . 	 0
for the real-life characters, the sensitive acting, the unadorned view of rural life and the subtle direction of the first-time newcomers to the scene, tully is worth a look. â¦ 	 1
director-in-chief of the film, tao zhuang, returns to the film with a visually powerful film that is a triumph of quiet power . 	 1
... a movie that, simply, should never have been made 	 0
the importance of sincerity, so thick with wit, like bartlett's familiar quotations 	 1
the screenplay credits five writers, seems like the one before 	 0
director alfonso cuaron has a great, convincing performance from a great cast, and generally, he goes very fast, using an omniscient voice-over narrator 	 1
...he's got a little bit of vampire fun 	 1
they say mean things and shoot a lot of bullets 	 0
welcome money back, real 	 0
the romantic comedy genre, which has been hostage to generic scripts that seek to remake sleepless in seattle, is now more than anything else, and it's a kiss of joy and spirit . 	 1
when she beat to pulp to abel ferrara, she gave the best performance since abel ferrara died 	 1
every frame is filled with joy and pride, and every other is filled with joy and pride . 	 1
the film has a repugnant and depressing effect 	 0
...to reveal more ambivalent characters and motives in the face of the normal portrayal of good kids and bad seeds . 	 1
it's all about lily chou-chou, which can make you cry 	 1
you and your friends have adventures, regardless of age 	 1
an empty shell of a great epic 	 0
-lrb- scherfig -rrb- has made a movie that'll leave you wondering about the lives of the characters . 	 1
it's a little ironic that the film makes the audience feel like the film is a victim of the audience, but it's also a very good quality, and it's a ight, and it's a ight, and it's a 	 1
a wonderful meal in the tradition of a movie 	 1
-lrb- johnnie and wai kai fai are -rrb- sure to be enthusiastic viewers of the film but the film interest may be limited 	 0
conceptually brilliant... is a war of worlds, with a whole lot of disturbing power from the unknown and the unknown . 	 1
it's as necessary as a hole in the head 	 0
-lrb- danny's amazing performance -rrb- is a real human soul hidden beneath a spellbinding serpent's grin . 	 1
in addition to hoffman's powerful clinic, this is a rare and thoughtful and rewarding glimpse into the kind of heartaches that everyone feels, or will feel someday 	 1
it's not a great movie but it's a good-hearted and sometimes funny movie 	 1
it's a clever and very entertaining picture, which is more accurate than chabrolian 	 1
he's looking, offering little insight into the fascinating subject 	 0
it's a pleasant and engaged sit but it's not enough to have a good balance between the two worlds 	 0
in particular, the idea that the marginal members of society might benefit from a helping hand and a friendly kick in their pants.. . 	 1
yakusho is wonderful like a sad face....and shimizu is very believable 	 1
it's thanks to the huston performance 	 1
ararat like a report from a book 	 0
the beautiful pictures and solemn words can't hide the slack complacency of -lrb- godard's -rrb- vision, as well as the beautiful piano and strings on the soundtrack . 	 0
it's a perfect film for a quiet, self-assured portrait of small town regret, love, duty and friendship that appeals to the storytelling instincts of a slightly more literate audience . 	 1
it's a shame the wonderful first half hour is mixed with the bad ending 	 0
a surprisingly charming and entertaining match for the best of hollywood comic-book adaptations . 	 1
i'm advising you to skip the movie and pick up the soundtrack 	 0
ambitious but impossible to achieve.. . 	 1
french filmmaker karim dridi, celebrating the spirit of cuban music . 	 1
family meals. . 	 1
the film completely avoid all the comic possibilities of the situation, and becomes a silly high school comedy about sex and prom night . 	 0
the most thoughtful film about art, ethics and the cost of morality . 	 1
even if you're an agnostic vegetarian, you can enjoy a lot of jonah, and you can laugh at it with a pronounced pythonsque flavor 	 1
the best of a growing series of daring films that argue that any sexual relationship that doesn't hurt nobody and works for its participants is a relationship that deserves respect 	 1
new york, it's not like anywhere else but new york 	 0
i know roberto benigni's pinocchio will be a bright shining star in the spirit of the season but i assure you, no wise man will follow him 	 0
evocative of a palpable disconnection, which is more striking in the constant use of mobile phones 	 1
they crushed under cars, thrown out windows, electrocuted and killed in full consciousness 	 0
in addition to originality -- plot of family, forgiveness and love -- lilo & stitch has a number of other assets to recommend it to the audience . 	 1
maybe it's cliche to say that the film is "fresh", but it's true 	 1
juwanna mann is even more absurd than you'd expect from a man in a dress 	 0
the film is a fascinating one about two men who discover what william james called "the gift of tears" 	 1
a fantastical, highly entertaining movie that's funny, sensual, and sympathetic to the story of two young men 	 1
...the story is far from the truth, illogical, and silly 	 0
lee seems to like a warm welcome 	 1
it's all about the silence and if you're into it, you'll sit and stare and turn away 	 0
a classic drama of substance about a teacher slide down slippery slope of dishonesty after a meeting with the rich and powerful who have nothing but contempt for virtue . 	 1
another pointless waste of a brutal mid-1970s american sports movie . 	 0
the kind of movie that leaves a vague impression and a nasty aftertaste but little clear memory of its operation . 	 0
the screenplay's full of humor and satire, which will keep the film entertaining 	 1
it's perfectly acceptable, occasionally entertaining children's entertainment like a literary desecration 	 1
you should think about this misery of this wretched movie 	 0
funky, crazy, consistent 	 1
everything missing is anything approaching a visceral kick, and anything approaching even a vague reason to sit down 	 0
the first watercolor background since ``dumbo'' is surely the most original in years 	 1
the film is thrilling, brisk, entertaining, while it has a certain weakness - like a rather unrealistic love interest and a long-lasting ending . 	 1
this is a documentary about a talk show but it's so cool 	 1
a very unpleasant movie . 	 0
instead of pulling a little from each film and creating something more beautiful than either of those movies 	 1
passed the litmus test of the generation gap and not bad enough to repel the generation of its fans 	 0
after seeing a movie, no other reason should be remembered 	 0
es que esos ojos de mã­a esos ojos de mã­a 	 0
only -lrb- and literally -rrb- are throwing sex toys and offering half-hearted paeans to empowerment that are often dismissed by the brutality of the jokes, most of which are women's . 	 0
it's so terrible. it's so terrible . 	 0
and every old war movie seems to rip out the movie, and the movie seems to rip out the movie , 	 0
chai structure et pacing is surprising weak 	 0
when you grow up with scooby, you'll love this movie 	 1
it's a fast-moving, hard-hitting documentary 	 1
if you from a family that eats, talks, fights, laughs, and fights, then you'll see this wonderful comedy 	 1
the director's mostly playin' it straight, turnin' the fable into a listless climb to the social ladder . 	 0
there's gotta be more than a lil' of that money, the scale of projects, the quality of arms, the beauty of the screen, the money 	 0
the film, which doesn't even mention political prisoners, poverty and boats of people trying to escape the country, is more romanticized than a kiss from a man in the middle of the 	 0
it's sad to see how far he's fallen 	 0
some episodes work, some don't 	 0
the film eventually gets to the real emotional part, which is a deep sadness, like the new england characters, who wander around in thick clouds of denial . 	 1
it's more disturbing for the relatively non-violent allusions to serial murders but it's more interesting to humanize the subject 	 0
a movie full of empty, fetishistic violence that's funny 	 0
wendigo is a genuinely frightening story for those who seek something different 	 1
in fact compared to other recent war movies, or any other john woo movies, it's not so much 	 0
it's a familiar story but it's a very sympathetic and intelligent story 	 1
it's a fascinating study of isolation and despair that will allow the sisters to recreate both the physical and emotional tension 	 1
representation of papin sister life and events that led her infamous rise to fame.. . 	 1
it's not as fresh or enjoyable as the previous one but it's enough to keep it from being a complete waste of time 	 1
the film doesn't change the myth 	 0
it's not a terrible movie, if only it was a great fail! â¦ 	 0
the script's too classic, tried-and-true comedy that doesn't differentiate it from the next comedy 	 0
a rote exercise in the animation and story . 	 0
in his last attempt, made a movie that wasn't just offensive - but it was cool 	 1
it's not a bad movie, just a mediocre movie 	 0
a smart, funny and very pretty romantic comedy . 	 1
stumblin', full of himself, with no moral clarity, and nothing to scream about 	 0
the director debut is a nice thing but it's not enough 	 0
he's got a gaudy hawaiian shirt on his sleeve 	 0
it's a great performance - we hope it's just a performance 	 1
the film approach to subject matter is too calm and thoughtful, and its characterizations are too thin, and it fails as a straight drama . 	 0
symbolically, red bridge, women's energy, a tribute to women to heal. â¡ââ 	 1
you're overwhelmed by the film, hopeful and, perhaps paradoxically, illuminated 	 1
the book, which was written by a 13 year old, could be a book about 1984 and farenheit 451 . 	 0
a delicate dance film . 	 1
-lrb- westbrook -rrb- is a great subject for camera 	 1
cusack is brilliant in this 	 1
it's a great and entertaining movie 	 1
never let your emotions go, never to be surprised by a surprising high, a painful low, and a hidden impulse to impulsively move . 	 1
caus chaos urban explosion capture a few movies, and the audience will shake as if they had seen a nesbitt co-worker 	 1
ferra's best film in years 	 1
au m'aimes pas dã©fait, dã©fait, dã©fait, dã©fait, dã©fait, dã©fait, dã©fait, dã 	 0
see the war photographer, and you think he hates the war he shows and empathizes with the victims he's exposing . 	 1
you could find a character more unattractive or disgusting -lrb- than leon -rrb- . 	 0
21st century reality, it was so hard to deal with it, it was sickening to be santa claus 	 0
it's not the best movie of the week but it's a great and ambitious one 	 1
the actors don't share no chemistry or charisma 	 0
ms. phoenix is completely lacking in charm and charisma, and she can't even bring herself to the initial anomie or her eventual awakening . 	 0
when the film is not distracted by characters frustration, it's busy inventing false, sitcom-like solutions to their problems. â¤ 	 0
polished, well made, movie . 	 1
the laughter is as rare as a snake 	 0
a deeply devastating event in the past year and a slow, painful process of healing that has followed in its wake . 	 1
but anyone can offend anyone... and anyone can offend anyone 	 0
in history it's gonna take a long and complicated course 	 0
a very well acted, quietly affecting drama of the police 	 1
the best movie i ever seen, constantly pulling up the rug from our feet, seeing things from a new perspective, and it's more intense 	 1
stitch is a bad mannered, ugly and destructive little * * * * * * . 	 0
more than enough to say for a lot of movies that flow through the hollywood pipeline without a spark of life -lrb- and a beautiful editing -rrb- that's more than enough to say for a lot of films that flow through the hollywood pipeline 	 1
charlie hahn has the eyes, the smiles, and the determined face needed to be a dick 	 1
instead became a painful endurance test 	 0
the film has -lrb- a few -rrb- moments but they're not very much 	 0
if you're not a religious film, don't come around 	 0
it's a fascinating documentary, a deeply personal portrait of an iconoclastic artist who was unbelievably unknown to his closest friends 	 1
a wild, charming, wonderful documentary . 	 1
a passionate, albeit flawed, treatment of the irish history is given a terrible day 	 1
american war for independence, which was a complete and bloody war, but not a drop of blood 	 0
if there's any doubt that peter o'fallon didn't have a bone in his body, angels should dispel it 	 0
but it's like most of the movie riddles, but it's like most of the movie riddles, but it's like most of the movie riddles, but it's like most of the movie riddles, but it's like most of 	 0
a remake of the longest football field . 	 0
watching witherspoon talent wasted in unnecessary movies like legally blonde and sweet home abomination, i mean, alabama . 	 0
kevin donovan's first time director has found something new, the fact that he's found something new is absolutely amazing 	 1
it's raw and action packed like a boxing match 	 1
it seems to me that the men of marginal intelligence, with reactionary ideas about women and a complete lack of empathy, play a cruel game . 	 0
veggies don't trouble the kids 	 1
too dull and tasteless to really be vulgar 	 0
it just don't work either way 	 0
it's aimed at the bathroom and it hits 	 0
the emperor's club, claiming to be a popular and easily marketable film, turns a blind eye to history it claims to teach . 	 0
the film is a film that's just experimental enough to alienate the audience but it's a film that's just a little experimental 	 0
two tedious chores are a great scare and a great surprise 	 1
you'll have a thoughtful, emotional movie 	 1
it's obvious that it's true 	 0
the first time a movie is a movie 	 1
little girls understand, and mccracken knows it's all a little 	 1
there's often a long way and there's too many of them 	 0
it was so great because it was so endlessly, absurdly, creative 	 1
that's extraordinary, in itself, is extraordinary 	 1
yeah, i know . 	 1
k-19: widowmaker is a great yarn 	 1
and that's what it's all about 	 1
it's an unbelievably moving film, and that's what makes it worth recommending 	 1
there's no doubt that confession isn't always coherent but it seems surprising and touching 	 1
the film is a summer camp talent show, hastily written, under rehearsed, arbitrarily planned and filled with crude humor and vulgarities . 	 0
filled with sharp edges and deep sadness its comic narrative 	 1
the second half of the second half is so warm and fuzzy that you might forgive him 	 1
the four feathers don't make a clear sense of purpose, and that's why the film is so important 	 0
the best of the best is a strong sense of humanity, and bertrand tavernier excellent safe-guarding -rrb- is a heart . 	 1
i'm back from the outside world, and i warn you: life is short. â¦ 	 0
despite the fact that the film is running a long way to the finish line, it's a good race, one that keeps you in the seat for long stretches 	 1
dark little morality tale, romantic comedy, little bit of morality tale . 	 1
they are the anonymous, easily replaceable forces that serve as the horror movie's terror 	 0
to watch these eccentricities, it's both motivating and pure joy 	 1
the greatest star wattage in spain is not enough to overcome the tragedy of the maudlin 	 0
director jay russell hobnail boots on natalie babbitt's gentle, charming 1975 children's book . 	 0
colorful, energetic and whimsical....the rare sequel that's better than the previous one 	 1
... pretentious and ultimately empty examination of a sick and evil woman . 	 0
a little movie with a big heart . 	 1
maggie g. is a breakthrough star and she eats the screen 	 1
the film is so dull it would be a welcome improvement to watch the paint dry 	 0
-lrb- the cockettes -rrb- is a window into a sub culture that's obsessed with expressing itself in every way possible . 	 1
the real horror may wait at home, and the horror of the audience may often talk about the specific scary scene or shocking moment 	 1
the difference between her comic and her most comics is that she's confident in her material 	 1
this remake of lina wertmuller's 1975 comedy is this biggest husband-wife disaster since john and bo derek's ridiculous bolero 	 0
-lrb- a -rrb- a bad joke 	 0
holland's film is a little less subtle, and far less crass - than some recent films about black professionals 	 1
...war between men and women and how to win the war is never stopped by the mouth of the rogers 	 1
lawrence personal tragedy and the human comedy . 	 1
by letting you share her one-bedroom world for a while, for a while, for a while . 	 1
he's often too heavy, too heavy, too light, too entertaining, and often well written 	 1
an inventive, absorbing movie that's as hard to classify as it is to resist 	 1
-lrb- russell -rrb- is a good movie -lrb- the mask, the blob -rrb- and the scorpion king . 	 1
the inevitable plot and tiresome histrionics -lrb- rifkin's -rrb- tale of precarious skid-row dignity pushed into the margins by the inevitable plot and tiresome histrionics . 	 0
the film's last scenes are sad, bitter and honest 	 1
no matter how high it rises, the rising place does not always justify its existence 	 0
it's all a trick, a trick to cover up the fact that the picture's built around a core of flimsy - or, worse, nonexistent - ideas . 	 0
such superficial treatment is too bad that it's given to a historical event that's too tragic 	 0
no one laughs . 	 0
but the actors make it worth it 	 1
a great big movie . 	 1
it's like a tired ad for the tyco 	 0
it's exactly the kind of movie that always accused a movie of being a bad one 	 0
mr. clooney, mr. kaufman and all their collaborators are entitled to a deep bow to fashion a highly entertaining and highly profitable from a highly unlikely to be fatal prescription . 	 1
it's impossible to find anything but alarming, shameless and manipulative and utterly lacking in conviction, and it's impossible to find anything but a terrible, shameless and manipulative and utterly lacking in conviction, and it's impossible 	 0
both deserve better than this 	 0
they both in the best of shows, de niro and murphy, the most savoury and hilarious guilty pleasure of the last few movies . 	 1
the film is a strange, thought-provoking, film, which doesn't bring you into characters like it does you study them 	 1
i know the movie 	 0
in the visual sense, santa clause 2 is wonderful 	 1
a tale of a new zealander with a rich visual clarity and deeply felt performance across the board . 	 1
it's better to know what's coming but you can take it with a little bit of a twist, willing to take the earnestness of the performance and skill of the cast . 	 1
a picture that can't be shaken 	 1
unable to be funny, unbelievably hopeless and essentially uninspired 	 0
bogdanich is unashamedly pro-serbian and does not try to speak out of the other side 	 0
like a pack of dynamite sticks, meant to be controversial 	 0
you'll be a slave for a year for a 12 year old boy 	 1
the only possible complaint you could have against miyazaki is that there's no rest period, no time limit 	 1
in this dark tale of revenge, director sam mendes shows tom hanks as a depression era assassin 	 1
veretã© is a smart man with a sense of narrative tricks 	 1
strange, a soap opera disguised as a movie 	 0
it's got the look and the period but it's also visual and verbal clich 	 0
the director of the film, robert kumble, offers a little bit of traditional romantic comedy 	 1
a modern comedy about benevolent deception, which, while it's not as good as the movies of the period, still deserves to be seen. â¦ 	 1
it's beautiful but it's tiresome and tiresome and tiresome 	 0
but you might not notice in a better movie 	 0
pretty good mix of the longest yard.... and the 1999 man caper 	 1
how ever does the work get too crude to serve the work, which is too fascinating to be re-enacted 	 0
if the main goal of horror movies is to scare and disturb, then it's so cool 	 1
oedekerk mug is brutal honesty, and the jokes are few and far between 	 0
silly - and often gross - but it's rarely as silly as some of the worst movies on campus 	 0
sparked by spielberg's first real masterpiece, which has won him hearts and won him a second time, 20 years later . 	 1
... unlike -lrb- scorsese mean streets -rrb-, ash wednesdays are essentially devoid of interesting characters or even a half-interesting plot . 	 0
you'll have to watch a movie twice or pick up a book on the subject 	 1
slow and ponderous but the drama of compassion, sacrifice and love of god is building in a very intense indoor drama . 	 1
sheridan's book is a rather toothless memoir of a young man's schoolboy 	 0
the film, which is a deeply moving meditation on love, history, memory, resistance and artistic transcendence, has never been more beautiful 	 1
untrained and lifeless underfoot 	 0
the film offers a fascinating scenario 	 1
the film looks tired and tired 	 0
haynes workt es noch ein emotional depth, es alsot es cultural depth of the 1950s . 	 1
i ain't never seen a movie so willing to admit the fallibility of human nature 	 1
a funny, quiet romantic comedy . 	 1
the film, which is a defiance of social norms, is a note of defiance in the film's direction, which is beautiful and detailed . 	 1
a pleasant little movie that's mostly about the simplicity of martha, and leaves you smiling and grumblin' 	 1
it's hard to quibble with a flick that boasts such a large number of real cackles but it's still a promising project 	 1
a hip-hop hip-hop fantasy filled with guns, expensive cars, lots of naked ladies and clothes 	 0
a strong and confident work that works so well for the first 89 minutes but ends up so confusing 	 1
even the hastily drawn and amateurish drawings can't engage 	 0
michael moore's perfect starting point for a national conversation about guns, violence and fear is a bowling game, "columbine" 	 1
it's enough for me 	 1
it's the funniest american comedy since the bridge 	 1
after the uncertain start, the homicide follows a series of murders and generally continues to increase the bullock's first interview with the gat with the ick 	 1
dogtown and the z-boys got a compelling story to tell, though they got no objectivity and no nostalgia 	 1
... a great crime drama that's slick as mamet 	 1
above all, foundering performance -lrb- madonna -rrb- denied her ability to move and move 	 0
if it weren't for the clever adaptation of the bard's tragic play, it would be a silly comedy, scotland, pa would be forgotten 	 1
mostly because of universal themes, earnest performances and excellent use of music by the popular gulzar and jagjit . 	 1
the only thing to give film points is bravado - to take a completely stale concept and push it through the audience's meat grinder . 	 0
the audience will be awake all the way through but the performances of pacino, williams and swank will keep the audience wide awake 	 1
a boring, pretentious, sensationalist, real-life 19th century crime is used as a metaphor -- well, i don't really know what -- and has all the dramatic weight of a drop . 	 0
it's a dazzling conceptual feat but more than that, it's a fascinating drama 	 1
the film is potent and provocative, with a powerful performance by ryan gosling - rb- - murder of numbers - rb- , 	 1
the film is increasingly hopelessly lost in the comedy of futility 	 0
it's almost as if the film's more interested in entertaining us than entertaining us 	 0
a cheap alien-looking copy of the alien-fantasy 	 0
only the worst elements of all indulged 	 0
late marriage, and that's why the debut of the best-selling feature is so potent 	 1
the whole movie is a big excuse to play a lot of sex scenes 	 0
a fascinating examination of the joyous, tumultuous self-discovery of a middle age woman . 	 1
it's a simple, unmistakable, easy-love 	 1
it's a rare window into the creative collaboration 	 1
report card: not the highest of the exalted tagline - there's surely room for improvement 	 0
the least accessible screed of the hartsley greatest screed is too focused on travails of being hal hartley 	 0
a real fan of comedy must see backstage 	 1
he had the strength but he didn't have the brains 	 0
he's no dramatic punch or depth 	 0
it might sound absurd but at least it's funny no-brainer 	 1
like a tragic figure, the painful end of days, collateral damage is a tragic figure, but sympathy is really needed for anyone who's got to watch him try to make a complicated â¦ 	 0
a cast of greats and a movie about growing up in a dysfunctional family . 	 1
the aid subtext is gay sex subtext, skims over reality of gay sex, presents yet another tired old gay community as a welcoming, middle-class, boring like antonia . 	 0
despite several attempts to discuss long-lasting dialogue scenes, the lead is so unmemorable that one eventually feels like it's a waste of breath 	 0
a little bit of a disappointment 	 0
